Question,Answer,Category
"more about cerificates","For the Prime Minister’s Special Scholarship Scheme (PMSSS), several certificates and documents are required to establish eligibility and verify the student's identity and background. Here’s a detailed overview of the key certificates and documents typically needed:

1. Domicile Certificate
Purpose: To prove that the student is a resident of Jammu & Kashmir or Ladakh.
Issuing Authority: Usually issued by the local revenue officer or a competent authority in the respective region.
Contents: Should include the student's name, address, and a statement confirming residency in J&K or Ladakh.
2. Income Certificate
Purpose: To confirm that the family's annual income does not exceed INR 8 lakh, as per the scheme’s financial eligibility criteria.
Issuing Authority: Issued by the local revenue officer, district magistrate, or other authorized government officials.
Contents: Should detail the total annual income of the student's family and be duly signed and stamped by the issuing authority.
3. 10+2 Marksheet
Purpose: To verify that the student has completed their 10+2 education or an equivalent qualification.
Issuing Authority: Issued by the board or examination authority that conducted the 10+2 examination.
Contents: Should include the student’s name, roll number, marks obtained, and details of the educational board.
4. Aadhaar Card
Purpose: For identity verification and to ensure accurate data collection.
Issuing Authority: Issued by the Unique Identification Authority of India (UIDAI).
Contents: Should include the student's name, photograph, Aadhaar number, and other demographic details.
5. Bank Account Details
Purpose: To facilitate the disbursement of the scholarship amount.
Required Documents: A copy of the student’s or parent’s bank passbook or account statement.
Contents: Should include the bank account number, account holder’s name, and bank branch details.
6. Passport-sized Photograph
Purpose: For identification and inclusion in the scholarship application.
Requirements: A recent passport-sized photograph (usually with a white background) is required.
Additional Documents (if applicable)
Transfer Certificate:

Purpose: If the student is transferring from another institution, a transfer certificate from the previous institution might be needed.
Caste/Category Certificate:

Purpose: If applicable, to claim benefits for specific categories like SC/ST/OBC.
Issuing Authority: Issued by the relevant government department or authority.
Disability Certificate:

Purpose: For students with disabilities, to avail any special provisions or support.
Issuing Authority: Issued by a recognized medical authority or government hospital.
Course Admission Letter:

Purpose: To confirm that the student has been admitted to a recognized course at an institution.
Contents: Should include details of the course, institution, and admission date.
Application and Verification Process
Online Submission:

Upload all required documents to the AICTE PMSSS portal during the online application process.
Document Verification:

Submit physical copies of documents at designated facilitation centers for verification.
Approval and Processing:

After verification, the documents are reviewed, and the scholarship is processed if all criteria are met.
Important Tips
Accuracy: Ensure that all documents are accurate, complete, and up-to-date.
Authenticity: Use original documents and obtain certificates from authorized authorities.
Timeliness: Submit documents within the stipulated deadlines to avoid delays in processing.
By providing the required certificates and documents, students can effectively apply for the PMSSS and receive the financial support needed for their higher education. If you have specific questions about any of the certificates or need further clarification on the application process, feel free to ask!","Application Process"
"Who is eligible for PMSSS?","Students who have passed 12th class or equivalent from a school located in Jammu & Kashmir or Ladakh, and have a family income of less than 8 lakhs per annum are eligible for PMSSS.","General Info"
"How many scholarships are awarded under PMSSS each year?"," PMSSS awards 5000 scholarships annually to eligible students from Jammu & Kashmir and Ladakh.","General Info"
"What does the PMSSS scholarship cover?","The PMSSS scholarship covers academic fees up to Rs. 3 lakh per annum and maintenance charges of Rs. 1 lakh per annum, which includes hostel fees and other incidental charges.","General Info"
"NO,I don't want to continue","Alright! Have a nice day","Application Process"
"Yes, I want to continue","Alright! What you want to know?","Application Process"
"PMSSS","The Prime Minister’s Special Scholarship Scheme (PMSSS) is an initiative by the Government of India designed to provide financial assistance to students from Jammu & Kashmir (J&K) and Ladakh. The scheme aims to support students in pursuing higher education by covering various educational expenses. Here’s a comprehensive overview of the PMSSS:

Objectives
Enhance Educational Opportunities: To provide financial aid to students from J&K and Ladakh to pursue higher education.
Reduce Financial Burden: To alleviate the financial constraints faced by students and their families in accessing quality education.
Promote Integration: To facilitate the integration of students from these regions with the rest of India through educational opportunities.
Eligibility Criteria
Residency:

Must be a resident of Jammu & Kashmir or Ladakh.
Proof required: Domicile certificate.
Academic Qualification:

Must have completed 10+2 or an equivalent examination from a recognized board.
Minimum marks may apply depending on the institution or course.
Income Limit:

Family income should not exceed INR 8 lakh per annum.
Proof required: Income certificate from a competent authority.
Course and Institution:

Applicable for undergraduate and diploma courses in recognized institutions across India.
Specific courses and institutions may be approved for the scholarship.
Financial Assistance Coverage
Tuition Fees:

Full coverage of tuition fees as specified by the institution.
Hostel Fees:

Assistance for accommodation or hostel fees.
Additional Expenses:

Support for books, stationery, and other educational materials.
Application Process
Online Registration:

Students need to register and apply through the AICTE PMSSS portal.
Document Submission:

Upload necessary documents such as domicile certificate, 10+2 marksheet, income certificate, Aadhaar card, bank account details, and a passport-sized photograph.
Verification:

Documents are verified at designated facilitation centers.
Selection:

Applications are reviewed, and scholarships are awarded based on eligibility and available funds.
Documents Required
Domicile Certificate: Proof of residence in J&K or Ladakh.
Income Certificate: Proof of family income not exceeding INR 8 lakh per annum.
10+2 Marksheet: Academic record of the 10+2 examination.
Aadhaar Card: For identity verification.
Bank Account Details: For scholarship disbursement.
Passport-sized Photograph: Recent photograph.
Renewal Criteria
Academic Performance:

Maintain satisfactory academic performance to continue receiving the scholarship.
Specific academic performance criteria may apply.
Reapplication:

Students may need to reapply or provide updated documentation for renewal.
Special Considerations
Merit-Based Selection:

Preference may be given to students with higher academic performance or specific achievements.
Special Provisions:

Additional provisions may be available for students with disabilities or other special needs.
Impact
The PMSSS has had a positive impact on improving access to higher education for students from J&K and Ladakh. By providing financial support, the scheme helps in the academic and personal development of students and facilitates their integration into mainstream educational systems.

Contact and Support
Helpline: For assistance, students can contact the PMSSS helpline.
Facilitation Centers: Designated centers assist with application submission, document verification, and general support.
For more specific information or if you have any particular questions about the PMSSS, feel free to ask!","General Info"




























